{
  "$schema": "./config.schema.json",
  "logit_gain": 0.25,
  "image_size": 28,
  "new_param_range": 0.1,
  "neurons_per_hidden_layer": 100,
  "num_hidden_layers": 2,
  "population_size": 50,
  "base_selection_pressure": 24,
  "mutation_milestones": [
    [0, 0.03],
    [500, 0.02],
    [1000, 0.01],
    [1500, 0.005],
    [2000, 0.002],
    [2500, 0.00125],
    [3000, 0.00008]
  ]
}
